news,date
Former ANP Senator Daud Achakzai injured in Chaman firing,10 months ago
Nawaz Maryam Challenges Conviction in IHC Seek Suspension of Sentences,10 months ago
PML-N Leaders Booked on Terrorism Charges Days Ahead of Elections,10 months ago
‘Waited for this election for 22 years’ – Imran,10 months ago
‘Lords of Lahore’ made lives hell for masses – Imran,10 months ago
NAB arrests Deputy Director QDA in Quetta,10 months ago
Son of soil Siraj Raisani laid to rest in Mastung,10 months ago
Amy Chief to attend Siraj Raisani’s funeral in Mastung,10 months ago
Shehbaz laments conduct of Nawaz’s trial in jail,10 months ago
CTD Arrest ‘Terrorist’ Involved in PTI MPA’s Murder in Hangu,10 months ago
Nawaz Maryam Given ‘B’ Class Facilities at Adiyala Jial,10 months ago
IS Claims Responsibility for Mastung Blast,10 months ago
Nawaz Sharif Maryam Arrested on Return,10 months ago
Suicide Bomber Kills 128 in Attack on Election Rally in Mastung,10 months ago
Thirsty Gwadar Enjoys Sustainable Sweet Desalted Seawater,10 months ago
SC Directs FPSC to Fill Vacancies of BPS-16 Above at PIMS,10 months ago
Imran Khan ‘Quietly Confident’ he will be PM,10 months ago
SC Allows Shahid Abbasi to Contest Polls from NA-57,10 months ago
4 Killed Several Injured in Blast Targeting Durrani’s Convoy in Bannu,10 months ago
Nawaz Flying Home to Face Jail Authorities Lock Down Lahore City,10 months ago
Won’t let Nawaz Sharif go to jail – Mother,10 months ago
ECP announces July 25 as public holiday,10 months ago
Shehbaz cries foul on PML-N workers’ arrest,10 months ago
Kulsoom Nawaz regains consciousness,10 months ago
Political ‘Turncoats’ Boost Imran Khan’s Prospects in Polls,10 months ago
SC Accepts Saad Rafique Appeal Against ET’s Decision,10 months ago
‘China Believes Pakistan Can Overcome Temporary Financial Difficulties’,10 months ago
NAB finalises preparations to arrest Nawaz Sharif,10 months ago
Zardari’s aide Hussain Lawai shifted to Islamabad,10 months ago
Zardari breaks silence on money laundering charges,10 months ago
Asif Zardari decides against appearing before SC,10 months ago
Funeral prayers for Haroon Bilour held in Peshawar,10 months ago
TTP claims responsibility for Peshawar suicide attack,10 months ago
13 Killed 47 injured in suicide blast in Peshawar,10 months ago
PPP Criticises ‘Pre-poll Rigging’ in Election,10 months ago
ANP leader Haroon Bilour martyred in suicide blast,10 months ago
Arrest warrants issued for Hussain Hassan Nawaz through Interpol,10 months ago
ECL Black List & Stop List: Do you know the difference?,10 months ago
UNDP HUM TV collaborate to empower Pakistani youth,10 months ago
Rao Anwar granted bail in Naqeebullah murder case,10 months ago
ECP takes notice of belay of Bilawal rallies in Punjab,10 months ago
ECP amends code of conduct Ddrects officers submit affidavit,10 months ago
PPP leads in women representation through award of tickets,10 months ago
Major political parties unveil manifestos ahead of general elections,10 months ago
Forces cecover arms ammunition as Operation Radd ul Fasaad continues,10 months ago
Youth injured in Indian Army firing in IHK dies,10 months ago
Federer leaves yet another rival chasing shadows,10 months ago
Names of Asif Zardari Faryal Taplur put on ECL,10 months ago
Armed forces donate two days salaries for dams,10 months ago
Imran Khan unveils PTI manifesto for election 2018,10 months ago
NAB summons Musharraf with family on July 10,10 months ago
Pakistan launches two satellites with help of China,10 months ago
Capt (retd) Safder shifted to Adiyala Jail,10 months ago
Masterful Rohit leads India to series win over England,10 months ago
Captain Safdar finally arrested from Rawalpindi,10 months ago
A 4.5 magnitude earthquake hits Swat,10 months ago
PML-N workers forcefully take Safdar off NAB’s custody,10 months ago
Pakistan Observes 2nd Death Anniversary of Abdul Sattar Edhi,10 months ago
Petroleum prices reduced in line with CJ’s orders,10 months ago
Nawaz Sharif daughter announce return on Friday,10 months ago
MMA candidate in Bannu injured in bomb attack,10 months ago
Indian Army Martyr Three Kashmiris in Kulgaam Area,10 months ago
Capt Safder’s Name Put on Blacklist After Conviction,10 months ago
60m Ballot Papers Printed for July 25 General Elections,10 months ago
Ali Malik to Contest from NA-127 after Maryam Disqualification,10 months ago
PML-N to Take Legal Constitutional Course over Nawaz Conviction: Kh Asif,10 months ago
Nawaz Sharif Sentenced to Prison in Avenfield Properties Case,10 months ago
15 killed 25 Injured in Road Accident in Nawabshah,10 months ago
MMA Out to Serve Masses: Liaqat Baloch,10 months ago
Court Rejects Sharifs’ Plea to Postpone Verdict in Avenfield Reference,10 months ago
Amid Heavy Downpour Risk of Water-borne Diseases High in Punjab,10 months ago
Ring of Pakistan: Foreign wrestlers love paan and mango lassi,10 months ago
PML-N Senator Zafar Ali Shah joins PTI,10 months ago
CEO BOL Network Shoaib Shaikh sentenced 7 years in jail,10 months ago
